{
  "agentCandidateCalls": 12,
  "artifactVersion": "s12.f-rf.internal-poc-candidate.v3",
  "candidateDigest": "sha256:fbe412d85bc06d6aa6edf1a68ab26146123dd2fa35308e31abf9542e39f2afaa",
  "candidateModel": "gpt-5.6-luna",
  "goldIncluded": false,
  "heldOutInspection": false,
  "nonClaims": [
    "candidate outputs are frozen for primary-agent proxy review only",
    "no scoring, review, acceptance, external validation, or human-quality claim",
    "no provider calls, held-out inspection, production enablement, selection, promotion, or release"
  ],
  "payloadDigest": "sha256:14fe2fed10c3bd33b4c7c9d4d2f8cec61727cfd2ddeed1dde6832ceb33480f2e",
  "payloadPath": "evaluation/sprint-12/internal-poc/s12-f-rf-blinded-source-payload.v3.json",
  "priorReviewsIncluded": false,
  "priorScoresIncluded": false,
  "providerCalls": 0,
  "rawSensitiveDataIncluded": false,
  "reasoning": "high",
  "records": [
    {
      "caseId": "s12-a-4001",
      "language": "vi",
      "response": {
        "abstentionReason": null,
        "entities": [
          {
            "candidateId": "poc-v3-01",
            "confidence": "0.74",
            "evidence": {
              "endOffset": 22,
              "startOffset": 9,
              "text": "cargo-routing"
            },
            "label": "cargo-routing",
            "type": "Requirement"
          }
        ],
        "links": [],
        "modelId": "gpt-5.6-luna",
        "modelVersion": "internal-poc-v3",
        "relations": [],
        "schemaVersion": "m3.v2",
        "usage": null
      },
      "responseDigest": "sha256:631fcf1bb0477b36f19cb188bea2c61491ebe16ca6c9581b91bd71a5b8a78ea7",
      "scenarioId": "s12-s-201",
      "sourceDigest": "sha256:f819e04d5af8f0a582b396edea3f5616abe895fb07b07c13106e374fd1141de0",
      "sourceVersion": {
        "canonicalContentDigest": "sha256:f819e04d5af8f0a582b396edea3f5616abe895fb07b07c13106e374fd1141de0",
        "canonicalizationVersion": "crlf-lf.v1",
        "contractVersion": "source-version.v1",
        "coordinateSystemVersion": "unicode-codepoint.v1",
        "originalContentDigest": "sha256:f819e04d5af8f0a582b396edea3f5616abe895fb07b07c13106e374fd1141de0",
        "parentCanonicalContentDigest": null,
        "parentSourceVersionId": null,
        "projectScopeId": "project_96d5cbf51add10d34acea0492318ce5440a4b8c9b822b3e0461133473f0af720",
        "receiptDigest": "sha256:f00e712ace394a0697d0bc1b092eb9c84f0e6fa05c328f2e7c4a9af469b7c034",
        "replayKey": "replay_ae5f379d71c31fb08e277fa708d6873d1571304c1a266df0a023420dc8075426",
        "retention": {
          "expiresOn": null,
          "policy": "until-unreferenced"
        },
        "sourceArtifactScopeId": "artifact_1fa6dfdc586c77f88367e00758c3c8a764cda3328c15e7177770507c09b67757",
        "sourceVersionId": "sv_ae5f379d71c31fb08e277fa708d6873d1571304c1a266df0a023420dc8075426"
      }
    },
    {
      "caseId": "s12-a-4011",
      "language": "mixed",
      "response": {
        "abstentionReason": null,
        "entities": [
          {
            "candidateId": "poc-v3-02",
            "confidence": "0.74",
            "evidence": {
              "endOffset": 39,
              "startOffset": 28,
              "text": "tax receipt"
            },
            "label": "tax receipt",
            "type": "Constraint"
          }
        ],
        "links": [],
        "modelId": "gpt-5.6-luna",
        "modelVersion": "internal-poc-v3",
        "relations": [],
        "schemaVersion": "m3.v2",
        "usage": null
      },
      "responseDigest": "sha256:26f15b3e636bb2c4e605febb7c5e9d4eb89c71a2aeffcd9bf89194c3ae01e0a3",
      "scenarioId": "s12-s-202",
      "sourceDigest": "sha256:5d8f5f7c7797ada99cb69cd7be15fb0ad19bfc95b4c9f91ca6dabeb4360ac35a",
      "sourceVersion": {
        "canonicalContentDigest": "sha256:5d8f5f7c7797ada99cb69cd7be15fb0ad19bfc95b4c9f91ca6dabeb4360ac35a",
        "canonicalizationVersion": "crlf-lf.v1",
        "contractVersion": "source-version.v1",
        "coordinateSystemVersion": "unicode-codepoint.v1",
        "originalContentDigest": "sha256:5d8f5f7c7797ada99cb69cd7be15fb0ad19bfc95b4c9f91ca6dabeb4360ac35a",
        "parentCanonicalContentDigest": null,
        "parentSourceVersionId": null,
        "projectScopeId": "project_96d5cbf51add10d34acea0492318ce5440a4b8c9b822b3e0461133473f0af720",
        "receiptDigest": "sha256:e736eb76a0aa300c4281cd9a05a761287068b674a262d545d3dec61a955d9100",
        "replayKey": "replay_c17bc8dd6acea7ca7aab672d08e1d5beb950db741c55d9b82fc720fe2c0c43cb",
        "retention": {
          "expiresOn": null,
          "policy": "until-unreferenced"
        },
        "sourceArtifactScopeId": "artifact_c005469e749b722f03810378e0d16791c2f208a9de0bbec710700afe3d8afe8b",
        "sourceVersionId": "sv_c17bc8dd6acea7ca7aab672d08e1d5beb950db741c55d9b82fc720fe2c0c43cb"
      }
    },
    {
      "caseId": "s12-a-4021",
      "language": "ja",
      "response": {
        "abstentionReason": null,
        "entities": [
          {
            "candidateId": "poc-v3-03",
            "confidence": "0.74",
            "evidence": {
              "endOffset": 18,
              "startOffset": 3,
              "text": "roster-planning"
            },
            "label": "roster-planning",
            "type": "Decision"
          }
        ],
        "links": [],
        "modelId": "gpt-5.6-luna",
        "modelVersion": "internal-poc-v3",
        "relations": [],
        "schemaVersion": "m3.v2",
        "usage": null
      },
      "responseDigest": "sha256:bc4cf824003961b4327febbc0c04430739c1f209cb2f5519d69800ffb7795aed",
      "scenarioId": "s12-s-203",
      "sourceDigest": "sha256:3c79f39f07cc6a5e03ba969247fe7062d31dafccda40e962b331d8fa1c671ff9",
      "sourceVersion": {
        "canonicalContentDigest": "sha256:3c79f39f07cc6a5e03ba969247fe7062d31dafccda40e962b331d8fa1c671ff9",
        "canonicalizationVersion": "crlf-lf.v1",
        "contractVersion": "source-version.v1",
        "coordinateSystemVersion": "unicode-codepoint.v1",
        "originalContentDigest": "sha256:3c79f39f07cc6a5e03ba969247fe7062d31dafccda40e962b331d8fa1c671ff9",
        "parentCanonicalContentDigest": null,
        "parentSourceVersionId": null,
        "projectScopeId": "project_96d5cbf51add10d34acea0492318ce5440a4b8c9b822b3e0461133473f0af720",
        "receiptDigest": "sha256:728c58d6ded1a1f7bdb7c51a93168e846ce921e532d184cf84aee97545d572fe",
        "replayKey": "replay_843301468b30f504de461d3eb9f5d45f0782a68be9b651148e623dc07f3eacde",
        "retention": {
          "expiresOn": null,
          "policy": "until-unreferenced"
        },
        "sourceArtifactScopeId": "artifact_72ad0ee39cce41cf977ebc1771b2430f4dde0f5bc450b487b9224bd682bf29e4",
        "sourceVersionId": "sv_843301468b30f504de461d3eb9f5d45f0782a68be9b651148e623dc07f3eacde"
      }
    },
    {
      "caseId": "s12-a-4031",
      "language": "vi",
      "response": {
        "abstentionReason": null,
        "entities": [
          {
            "candidateId": "poc-v3-04",
            "confidence": "0.74",
            "evidence": {
              "endOffset": 22,
              "startOffset": 9,
              "text": "mobile-wallet"
            },
            "label": "mobile-wallet",
            "type": "Constraint"
          }
        ],
        "links": [],
        "modelId": "gpt-5.6-luna",
        "modelVersion": "internal-poc-v3",
        "relations": [],
        "schemaVersion": "m3.v2",
        "usage": null
      },
      "responseDigest": "sha256:c2e8408ad06f8c4669430310f05f996a6745771dd9c7d2a132354b255ad851d3",
      "scenarioId": "s12-s-204",
      "sourceDigest": "sha256:f38b457203e618b709ccac1db43f9e115be1e646b55713b89c6c4c535dd54326",
      "sourceVersion": {
        "canonicalContentDigest": "sha256:f38b457203e618b709ccac1db43f9e115be1e646b55713b89c6c4c535dd54326",
        "canonicalizationVersion": "crlf-lf.v1",
        "contractVersion": "source-version.v1",
        "coordinateSystemVersion": "unicode-codepoint.v1",
        "originalContentDigest": "sha256:f38b457203e618b709ccac1db43f9e115be1e646b55713b89c6c4c535dd54326",
        "parentCanonicalContentDigest": null,
        "parentSourceVersionId": null,
        "projectScopeId": "project_96d5cbf51add10d34acea0492318ce5440a4b8c9b822b3e0461133473f0af720",
        "receiptDigest": "sha256:593d4d9a6c553366e0fa754f1800a9b7b494d073e49b44cb76da740960aadbec",
        "replayKey": "replay_35342924414271ab8e030a62fe6c052939ace55b78a83f96e928064598fd4a5c",
        "retention": {
          "expiresOn": null,
          "policy": "until-unreferenced"
        },
        "sourceArtifactScopeId": "artifact_061eb49e0c84d85d143b8205d7dc49bea406e78b384f16b2ab112999e732d4ef",
        "sourceVersionId": "sv_35342924414271ab8e030a62fe6c052939ace55b78a83f96e928064598fd4a5c"
      }
    },
    {
      "caseId": "s12-a-4033",
      "language": "vi",
      "response": {
        "abstentionReason": null,
        "entities": [
          {
            "candidateId": "poc-v3-05",
            "confidence": "0.74",
            "evidence": {
              "endOffset": 19,
              "startOffset": 9,
              "text": "lab-sample"
            },
            "label": "lab-sample",
            "type": "Requirement"
          }
        ],
        "links": [],
        "modelId": "gpt-5.6-luna",
        "modelVersion": "internal-poc-v3",
        "relations": [],
        "schemaVersion": "m3.v2",
        "usage": null
      },
      "responseDigest": "sha256:8ccbbe59939a03b186b0127dc609ebd6f61fe863d03aa5007f1f2a73dc8f3daa",
      "scenarioId": "s12-s-205",
      "sourceDigest": "sha256:5c1b2fa1a2f18395170c950535b3ee64f73e9bc7f16176cf5d14d20724cc2343",
      "sourceVersion": {
        "canonicalContentDigest": "sha256:5c1b2fa1a2f18395170c950535b3ee64f73e9bc7f16176cf5d14d20724cc2343",
        "canonicalizationVersion": "crlf-lf.v1",
        "contractVersion": "source-version.v1",